{"format":"OpenInfluence.RewardCertificate/v1","numeric_mode":"rational_exact","metadata":{"producer":"CategoricalInfluenceDiagrams.jl","producer_version":"0.1.0","julia_version":"1.12.7","description":"the oil wildcatter composite with exact rational companions"},"network":{"variableCount":4,"variableData":[{"name":"Oil","spaceRef":{"tag":"noRef"},"stateRows":[{"name":"dry","position":1},{"name":"wet","position":2}],"rank":0},{"name":"Test","spaceRef":{"tag":"noRef"},"stateRows":[{"name":"test","position":1},{"name":"skip","position":2}],"rank":1},{"name":"Result","spaceRef":{"tag":"noRef"},"stateRows":[{"name":"pos","position":1},{"name":"neg","position":2},{"name":"none","position":3}],"rank":2},{"name":"Drill","spaceRef":{"tag":"noRef"},"stateRows":[{"name":"drill","position":1},{"name":"dont","position":2}],"rank":3}],"mechanisms":[{"name":"Oil_mechanism","kernelRef":{"tag":"noRef"},"target":0,"inputRows":[]},{"name":"Result_mechanism","kernelRef":{"tag":"noRef"},"target":2,"inputRows":[{"varId":0,"position":1},{"varId":1,"position":2}]},{"name":"Test","kernelRef":{"tag":"policy","decision":"Test"},"target":1,"inputRows":[]},{"name":"Drill","kernelRef":{"tag":"policy","decision":"Drill"},"target":3,"inputRows":[{"varId":1,"position":1},{"varId":2,"position":2}]}],"inputs":[],"outputs":[]},"observability":{"inputs":[],"outputs":[]},"chance_tables":[{"mechanism":0,"cells":[{"q":{"num":"1","den":"2"},"f64":"3fe0000000000000"},{"q":{"num":"1","den":"2"},"f64":"3fe0000000000000"}]},{"mechanism":1,"cells":[{"q":{"num":"3","den":"10"},"f64":"3fd3333333333333"},{"q":{"num":"7","den":"10"},"f64":"3fe6666666666666"},{"q":{"num":"0","den":"1"},"f64":"0000000000000000"},{"q":{"num":"0","den":"1"},"f64":"0000000000000000"},{"q":{"num":"0","den":"1"},"f64":"0000000000000000"},{"q":{"num":"1","den":"1"},"f64":"3ff0000000000000"},{"q":{"num":"4","den":"5"},"f64":"3fe999999999999a"},{"q":{"num":"1","den":"5"},"f64":"3fc999999999999a"},{"q":{"num":"0","den":"1"},"f64":"0000000000000000"},{"q":{"num":"0","den":"1"},"f64":"0000000000000000"},{"q":{"num":"0","den":"1"},"f64":"0000000000000000"},{"q":{"num":"1","den":"1"},"f64":"3ff0000000000000"}]}],"utilities":[{"name":"TestCost","scopeRows":[{"varId":1,"position":1}],"cells":[{"q":{"num":"-10","den":"1"},"f64":"c024000000000000"},{"q":{"num":"0","den":"1"},"f64":"0000000000000000"}]},{"name":"Payoff","scopeRows":[{"varId":0,"position":1},{"varId":3,"position":2}],"cells":[{"q":{"num":"-60","den":"1"},"f64":"c04e000000000000"},{"q":{"num":"0","den":"1"},"f64":"0000000000000000"},{"q":{"num":"100","den":"1"},"f64":"4059000000000000"},{"q":{"num":"0","den":"1"},"f64":"0000000000000000"}]}],"strategy":[{"decision":"Test","actions":[1]},{"decision":"Drill","actions":[1,2,2,2,2,1]}],"result":{"arithmetic":"binary64","K":[{"f64":"3ff0000000000000"}],"W":[{"f64":"4035000000000000"}]}}
