{"format":"OpenInfluence.RewardCertificate/v1","numeric_mode":"binary64_exact","metadata":{"producer":"CategoricalInfluenceDiagrams.jl","producer_version":"0.1.0","julia_version":"1.12.7","description":"the decision half of the umbrella split, with Forecast observed on input"},"network":{"variableCount":3,"variableData":[{"name":"Weather","spaceRef":{"tag":"noRef"},"stateRows":[{"name":"sunny","position":1},{"name":"rainy","position":2}],"rank":0},{"name":"Forecast","spaceRef":{"tag":"noRef"},"stateRows":[{"name":"sunny","position":1},{"name":"cloudy","position":2},{"name":"rainy","position":3}],"rank":1},{"name":"Umbrella","spaceRef":{"tag":"noRef"},"stateRows":[{"name":"take","position":1},{"name":"leave","position":2}],"rank":2}],"mechanisms":[{"name":"Umbrella","kernelRef":{"tag":"policy","decision":"Umbrella"},"target":2,"inputRows":[{"varId":1,"position":1}]}],"inputs":[{"varId":0,"attrs":{"name":"Weather","spaceRef":{"tag":"noRef"},"states":["sunny","rainy"]}},{"varId":1,"attrs":{"name":"Forecast","spaceRef":{"tag":"noRef"},"states":["sunny","cloudy","rainy"]}}],"outputs":[]},"observability":{"inputs":["hidden","observed"],"outputs":[]},"chance_tables":[],"utilities":[{"name":"U","scopeRows":[{"varId":0,"position":1},{"varId":2,"position":2}],"cells":[{"f64":"4034000000000000"},{"f64":"4059000000000000"},{"f64":"4051800000000000"},{"f64":"0000000000000000"}]}],"strategy":[{"decision":"Umbrella","actions":[2,2,1]}],"result":{"arithmetic":"binary64","K":[{"f64":"3ff0000000000000"},{"f64":"3ff0000000000000"},{"f64":"3ff0000000000000"},{"f64":"3ff0000000000000"},{"f64":"3ff0000000000000"},{"f64":"3ff0000000000000"}],"W":[{"f64":"4059000000000000"},{"f64":"4059000000000000"},{"f64":"4034000000000000"},{"f64":"0000000000000000"},{"f64":"0000000000000000"},{"f64":"4051800000000000"}]}}
