{"format":"OpenInfluence.RewardCertificate/v1","numeric_mode":"binary64_exact","metadata":{"producer":"CategoricalInfluenceDiagrams.jl","producer_version":"0.1.0","julia_version":"1.12.7","description":"a pass-through variable and a copied output"},"network":{"variableCount":3,"variableData":[{"name":"Oil","spaceRef":{"tag":"noRef"},"stateRows":[{"name":"dry","position":1},{"name":"wet","position":2}],"rank":0},{"name":"Report","spaceRef":{"tag":"noRef"},"stateRows":[{"name":"good","position":1},{"name":"bad","position":2}],"rank":1},{"name":"Act","spaceRef":{"tag":"noRef"},"stateRows":[{"name":"go","position":1},{"name":"stop","position":2}],"rank":2}],"mechanisms":[{"name":"Report_mechanism","kernelRef":{"tag":"noRef"},"target":1,"inputRows":[{"varId":0,"position":1}]},{"name":"Act","kernelRef":{"tag":"policy","decision":"Act"},"target":2,"inputRows":[{"varId":1,"position":1}]}],"inputs":[{"varId":0,"attrs":{"name":"Oil","spaceRef":{"tag":"noRef"},"states":["dry","wet"]}}],"outputs":[{"varId":0,"attrs":{"name":"Oil","spaceRef":{"tag":"noRef"},"states":["dry","wet"]}},{"varId":1,"attrs":{"name":"Report","spaceRef":{"tag":"noRef"},"states":["good","bad"]}},{"varId":1,"attrs":{"name":"Report","spaceRef":{"tag":"noRef"},"states":["good","bad"]}}]},"observability":{"inputs":["observed"],"outputs":["hidden","observed","observed"]},"chance_tables":[{"mechanism":0,"cells":[{"f64":"3fc999999999999a"},{"f64":"3fe999999999999a"},{"f64":"3feccccccccccccd"},{"f64":"3fb999999999999a"}]}],"utilities":[{"name":"Gain","scopeRows":[{"varId":0,"position":1},{"varId":2,"position":2}],"cells":[{"f64":"c014000000000000"},{"f64":"0000000000000000"},{"f64":"4028000000000000"},{"f64":"0000000000000000"}]}],"strategy":[{"decision":"Act","actions":[1,2]}],"result":{"arithmetic":"binary64","K":[{"f64":"3fc999999999999a"},{"f64":"0000000000000000"},{"f64":"0000000000000000"},{"f64":"3fe999999999999a"},{"f64":"0000000000000000"},{"f64":"0000000000000000"},{"f64":"0000000000000000"},{"f64":"0000000000000000"},{"f64":"0000000000000000"},{"f64":"0000000000000000"},{"f64":"0000000000000000"},{"f64":"0000000000000000"},{"f64":"3feccccccccccccd"},{"f64":"0000000000000000"},{"f64":"0000000000000000"},{"f64":"3fb999999999999a"}],"W":[{"f64":"bff0000000000000"},{"f64":"0000000000000000"},{"f64":"0000000000000000"},{"f64":"0000000000000000"},{"f64":"0000000000000000"},{"f64":"0000000000000000"},{"f64":"0000000000000000"},{"f64":"0000000000000000"},{"f64":"0000000000000000"},{"f64":"0000000000000000"},{"f64":"0000000000000000"},{"f64":"0000000000000000"},{"f64":"402599999999999a"},{"f64":"0000000000000000"},{"f64":"0000000000000000"},{"f64":"0000000000000000"}]}}
