{
 "format": "OpenInfluence.RewardCertificate/v1",
 "numeric_mode": "binary64_exact",
 "metadata": {
  "producer": "hand_fixtures.py",
  "producer_version": "0.1.0",
  "julia_version": "none",
  "description": "hand-made: closed dyadic umbrella"
 },
 "network": {
  "variableCount": 3,
  "variableData": [
   {
    "name": "Weather",
    "spaceRef": {
     "tag": "noRef"
    },
    "stateRows": [
     {
      "name": "rain",
      "position": 1
     },
     {
      "name": "dry",
      "position": 2
     }
    ],
    "rank": 0
   },
   {
    "name": "Forecast",
    "spaceRef": {
     "tag": "noRef"
    },
    "stateRows": [
     {
      "name": "sunny",
      "position": 1
     },
     {
      "name": "rainy",
      "position": 2
     }
    ],
    "rank": 1
   },
   {
    "name": "Umbrella",
    "spaceRef": {
     "tag": "noRef"
    },
    "stateRows": [
     {
      "name": "take",
      "position": 1
     },
     {
      "name": "leave",
      "position": 2
     }
    ],
    "rank": 2
   }
  ],
  "mechanisms": [
   {
    "name": "Weather",
    "kernelRef": {
     "tag": "named",
     "id": "weather"
    },
    "target": 0,
    "inputRows": []
   },
   {
    "name": "Forecast",
    "kernelRef": {
     "tag": "named",
     "id": "forecast"
    },
    "target": 1,
    "inputRows": [
     {
      "varId": 0,
      "position": 1
     }
    ]
   },
   {
    "name": "Umbrella",
    "kernelRef": {
     "tag": "policy",
     "decision": "Umbrella"
    },
    "target": 2,
    "inputRows": [
     {
      "varId": 1,
      "position": 1
     }
    ]
   }
  ],
  "inputs": [],
  "outputs": []
 },
 "observability": {
  "inputs": [],
  "outputs": []
 },
 "chance_tables": [
  {
   "mechanism": 0,
   "cells": [
    {
     "f64": "3fd0000000000000"
    },
    {
     "f64": "3fe8000000000000"
    }
   ]
  },
  {
   "mechanism": 1,
   "cells": [
    {
     "f64": "3fd0000000000000"
    },
    {
     "f64": "3fe8000000000000"
    },
    {
     "f64": "3fe8000000000000"
    },
    {
     "f64": "3fd0000000000000"
    }
   ]
  }
 ],
 "utilities": [
  {
   "name": "U",
   "scopeRows": [
    {
     "varId": 2,
     "position": 2
    },
    {
     "varId": 0,
     "position": 1
    }
   ],
   "cells": [
    {
     "f64": "4051800000000000"
    },
    {
     "f64": "0000000000000000"
    },
    {
     "f64": "4034000000000000"
    },
    {
     "f64": "4059000000000000"
    }
   ]
  }
 ],
 "strategy": [
  {
   "decision": "Umbrella",
   "actions": [
    2,
    1
   ]
  }
 ],
 "result": {
  "arithmetic": "binary64",
  "K": [
   {
    "f64": "3ff0000000000000"
   }
  ],
  "W": [
   {
    "f64": "4052480000000000"
   }
  ]
 }
}
