{"format":"OpenInfluence.RewardCertificate/v1","numeric_mode":"binary64_exact","metadata":{"producer":"CategoricalInfluenceDiagrams.jl","producer_version":"0.1.0","julia_version":"1.12.7","description":"dyadic chance tables: binary64 rows sum to exactly one"},"network":{"variableCount":3,"variableData":[{"name":"Weather","spaceRef":{"tag":"noRef"},"stateRows":[{"name":"sunny","position":1},{"name":"rainy","position":2}],"rank":0},{"name":"Forecast","spaceRef":{"tag":"noRef"},"stateRows":[{"name":"sunny","position":1},{"name":"cloudy","position":2},{"name":"rainy","position":3}],"rank":1},{"name":"Umbrella","spaceRef":{"tag":"noRef"},"stateRows":[{"name":"take","position":1},{"name":"leave","position":2}],"rank":2}],"mechanisms":[{"name":"Forecast_mechanism","kernelRef":{"tag":"noRef"},"target":1,"inputRows":[{"varId":0,"position":1}]},{"name":"Umbrella","kernelRef":{"tag":"policy","decision":"Umbrella"},"target":2,"inputRows":[{"varId":1,"position":1}]}],"inputs":[{"varId":0,"attrs":{"name":"Weather","spaceRef":{"tag":"noRef"},"states":["sunny","rainy"]}}],"outputs":[{"varId":1,"attrs":{"name":"Forecast","spaceRef":{"tag":"noRef"},"states":["sunny","cloudy","rainy"]}}]},"observability":{"inputs":["hidden"],"outputs":["observed"]},"chance_tables":[{"mechanism":0,"cells":[{"f64":"3fe0000000000000"},{"f64":"3fd0000000000000"},{"f64":"3fd0000000000000"},{"f64":"3fc0000000000000"},{"f64":"3fd0000000000000"},{"f64":"3fe4000000000000"}]}],"utilities":[{"name":"U","scopeRows":[{"varId":0,"position":1},{"varId":2,"position":2}],"cells":[{"f64":"4034000000000000"},{"f64":"4059000000000000"},{"f64":"4051800000000000"},{"f64":"0000000000000000"}]}],"strategy":[{"decision":"Umbrella","actions":[2,1,1]}],"result":{"arithmetic":"binary64","K":[{"f64":"3fe0000000000000"},{"f64":"3fd0000000000000"},{"f64":"3fd0000000000000"},{"f64":"3fc0000000000000"},{"f64":"3fd0000000000000"},{"f64":"3fe4000000000000"}],"W":[{"f64":"4049000000000000"},{"f64":"4014000000000000"},{"f64":"4014000000000000"},{"f64":"0000000000000000"},{"f64":"4031800000000000"},{"f64":"4045e00000000000"}]}}
